user_input,retrieved_contexts,response,reference,context_precision,context_recall,faithfulness,answer_relevancy,answer_correctness
how spark helps HRs,"['**How to Get Started**\n\n****\n\n* \n* \n\n!\n\n---\n\nMake the smart choice for your organization\'s HR and Recruitment Management. \n\nJoin the **Spark**.work revolution today and transform your department into a successful, efficient and strategic powerhouse!\n\n                    \n                \n                    \n                    \n                            Metadata:\n                            {\n  ""lang"": ""en""\n}\n                        \n                    \n                        \n                            ', '**How to Get Started**\n\n****\n\n* \n* \n\n!\n\n---\n\nMake the smart choice for your organization\'s HR and Recruitment Management. \n\nJoin the **Spark**.work revolution today and transform your department into a successful, efficient and strategic powerhouse!\n\n                    \n                \n                    \n                    \n                            Metadata:\n                            {\n  ""lang"": ""en""\n}\n                        \n                    \n                        \n                            ', '**How to Get Started**\n\n****\n\n* \n* \n\n!\n\n---\n\nMake the smart choice for your organization\'s HR and Recruitment Management. \n\nJoin the **Spark**.work revolution today and transform your department into a successful, efficient and strategic powerhouse!\n\n                    \n                \n                    \n                    \n                            Metadata:\n                            {\n  ""lang"": ""en""\n}\n                        \n                    \n                        \n                            ']","Spark.work helps organizations manage their HR and recruitment.  Transforming the HR department into a successful, efficient, and strategic powerhouse.
",HR and recruitment management,0.0,1.0,1.0,,0.7039525466451786
